DistCode,District,College Code,College Name,OC,BCM,BC,MBC,SCA,SC,ST
1,ARIYALUR,3462,ARIYALUR ENGINEERING COLLEGE,,,,,,,
1,ARIYALUR,3781,K.K.C COLLEGE OF ENGINEERING AND TECHNOLOGY,,,,,,,
1,ARIYALUR,3857,MEENAKSHI RAMASWAMY ENGINEERING COLLEGE,,,,,,,
1,ARIYALUR,3466,NELLIANDAVAR INSTITUTE OF TECHNOLOGY,,,,,,,
1,ARIYALUR,3016,UNIVERSITY COLLEGE OF ENGINEERING  ARIYALUR,,,,,,,
2,CHENNAI,1321,CENTRAL INSTITUTE OF PLASTICS ENGINEERING AND TECHNOLOGY,,,,,,,
2,CHENNAI,1447,JAWAHAR ENGINEERING COLLEGE,,,,,,,
2,CHENNAI,1450,LOYOLA - ICAM COLLEGE OF ENGINEERING AND TECHNOLOGY,,,,,,,
2,CHENNAI,1509,MEENAKSHI COLLEGE OF ENGINEERING,,,,,,,
2,CHENNAI,1309,MEENAKSHI SUNDARARAJAN ENGINEERING COLLEGE,,,,,,,
2,CHENNAI,2,UNIVERSITY DEPARTMENTS OF ANNA UNIVERSITY  CHENNAI - ACT CAMPUS,,,,,,,
2,CHENNAI,1,UNIVERSITY DEPARTMENTS OF ANNA UNIVERSITY  CHENNAI - CEG CAMPUS,,,,,,,
3,COIMBATORE,2604,A.S.L. PAULS COLLEGE OF ENGINEERING AND TECHNOLOGY,,,,,,,
3,COIMBATORE,2744,ADITHYA INSTITUTE OF TECHNOLOGY,,,,,,,
3,COIMBATORE,2763,AKSHAYA COLLEGE OF ENGINEERING & TECHNOLOGY,,,,,,,
3,COIMBATORE,2367,ARJUN COLLEGE OF TECHNOLOGY,,,,,,,
3,COIMBATORE,2338,ASIAN COLLEGE OF ENGINEERING AND TECHNOLOGY,,,,,,,
3,COIMBATORE,2772,C M S COLLEGE OF ENGINEERING AND TECHNOLOGY,,,,,,,
3,COIMBATORE,2650,CHRIST THE KING ENGINEERING COLLEGE,,,,,,,
3,COIMBATORE,2704,COIMBATORE INSTITUTE OF ENGINEERING AND TECHNOLOGY,,,,,,,
3,COIMBATORE,2007,COIMBATORE INSTITUTE OF TECHNOLOGY (AUTONOMOUS),,,,,,,
3,COIMBATORE,2349,DHAANISH AHMED INSTITUTE OF TECHNOLOGY,,,,,,,
3,COIMBATORE,2743,DHANALAKSHMI SRINIVASAN COLLEGE OF ENGINEERING,,,,,,,
3,COIMBATORE,2706,DR. MAHALINGAM COLLEGE OF ENGINEERING & TECHNOLOGY (AUTONOMOUS),,,,,,,
3,COIMBATORE,2736,DR.N G P INSTITUTE OF TECHNOLOGY,,,,,,,
3,COIMBATORE,2749,EASA COLLEGE OF ENGINEERING AND TECHNOLOGY,,,,,,,
3,COIMBATORE,2005,GOVERNMENT COLLEGE OF TECHNOLOGY  COIMBATORE (AUTONOMOUS),,,,,,,
3,COIMBATORE,2708,HINDUSTHAN COLLEGE OF ENGINEERING AND TECHNOLOGY,,,,,,,
3,COIMBATORE,2740,HINDUSTHAN INSTITUTE OF TECHNOLOGY,,,,,,,
3,COIMBATORE,2732,INFO INSTITUTE OF ENGINEERING,,,,,,,
3,COIMBATORE,2769,J C T COLLEGE OF ENGINEERING AND TECHNOLOGY,,,,,,,
3,COIMBATORE,2762,JANSONS INSTITUTE OF TECHNOLOGY,,,,,,,
3,COIMBATORE,2764,K P R INSTITUTE OF ENGINEERING AND TECHNOLOGY,,,,,,,
3,COIMBATORE,2770,KALAIVANI COLLEGE OF TECHNOLOGY,,,,,,,
3,COIMBATORE,2710,KARPAGAM COLLEGE OF ENGINEERING (AUTONOMOUS),,,,,,,
3,COIMBATORE,2735,KARPAGAM INSTITUTE OF TECHNOLOGY,,,,,,,
3,COIMBATORE,2745,KATHIR COLLEGE OF ENGINEERING,,,,,,,
3,COIMBATORE,2751,KGISL INSTITUTE OF TECHNOLOGY,,,,,,,
3,COIMBATORE,2750,KIT - KALAIGNAR KARUNANIDHI INSTITUTE OF TECHNOLOGY,,,,,,,
3,COIMBATORE,2746,KTVR KNOWLEDGE PARK FOR ENGINEERING AND TECHNOLOGY,,,,,,,
3,COIMBATORE,2712,KUMARAGURU COLLEGE OF TECHNOLOGY (AUTONOMOUS),,,,,,,
3,COIMBATORE,2714,MAHARAJA ENGINEERING COLLEGE,,,,,,,
3,COIMBATORE,2730,MAHARAJA INSTITUTE OF TECHNOLOGY,,,,,,,
3,COIMBATORE,2724,MAHARAJA PRITHVI ENGINEERING COLLEGE,,,,,,,
3,COIMBATORE,2729,NEHRU INSTITUTE OF ENGINEERING AND TECHNOLOGY,,,,,,,
3,COIMBATORE,2755,NEHRU INSTITUTE OF TECHNOLOGY,,,,,,,
3,COIMBATORE,2741,P A COLLEGE OF ENGINEERING AND TECHNOLOGY,,,,,,,
3,COIMBATORE,2006,P.S.G. COLLEGE OF TECHNOLOGY (AUTONOMOUS),,,,,,,
3,COIMBATORE,2716,PARK COLLEGE OF ENGINEERING AND TECHNOLOGY,,,,,,,
3,COIMBATORE,2768,PARK COLLEGE OF TECHNOLOGY,,,,,,,
3,COIMBATORE,2354,POLLACHI INSTITUTE OF ENGINEERING AND TECHNOLOGY,,,,,,,
3,COIMBATORE,2753,PPG INSTITUTE OF TECHNOLOGY,,,,,,,
3,COIMBATORE,2377,PSG INSTITUTE OF TECHNOLOGY AND APPLIED RESEARCH,,,,,,,
3,COIMBATORE,2731,R V S COLLEGE OF ENGINEERING AND TECHNOLOGY,,,,,,,
3,COIMBATORE,2737,RANGANATHAN ENGINEERING COLLEGE,,,,,,,
3,COIMBATORE,2329,RATHINAM TECHNICAL CAMPUS,,,,,,,
3,COIMBATORE,2776,RVS TECHNICAL CAMPUS - COIMBATORE,,,,,,,
3,COIMBATORE,2734,S N S COLLEGE OF ENGINEERING,,,,,,,
3,COIMBATORE,2654,S V S COLLEGE OF ENGINEERING,,,,,,,
3,COIMBATORE,2738,SASURIE ACADEMY OF ENGINEERING,,,,,,,
3,COIMBATORE,2726,SNS COLLEGE OF TECHNOLOGY (AUTONOMOUS),,,,,,,
3,COIMBATORE,2673,SREE SAKTHI ENGINEERING COLLEGE,,,,,,,
3,COIMBATORE,2739,SRI ESHWAR COLLEGE OF ENGINEERING,,,,,,,
3,COIMBATORE,2718,SRI KRISHNA COLLEGE OF ENGINEERING & TECHNOLOGY (AUTONOMOUS),,,,,,,
3,COIMBATORE,2722,SRI KRISHNA COLLEGE OF TECHNOLOGY (AUTONOMOUS),,,,,,,
3,COIMBATORE,2719,SRI RAMAKRISHNA ENGINEERING COLLEGE (AUTONOMOUS),,,,,,,
3,COIMBATORE,2725,SRI RAMAKRISHNA INSTITUTE OF TECHNOLOGY,,,,,,,
3,COIMBATORE,2342,SRI RANGANATHAR INSTITUTE OF ENGINEERING & TECHNOLOGY,,,,,,,
3,COIMBATORE,2727,SRI SHAKTHI INSTITUTE OF ENGINEERING AND TECHNOLOGY,,,,,,,
3,COIMBATORE,2765,SRIGURU INSTITUTE OF TECHNOLOGY,,,,,,,
3,COIMBATORE,2360,SUGUNA COLLEGE OF ENGINEERING,,,,,,,
3,COIMBATORE,2721,TAMILNADU COLLEGE OF ENGINEERING,,,,,,,
3,COIMBATORE,2757,TEJAA SHAKTHI INSTITUTE OF TECHNOLOGY FOR WOMEN,,,,,,,
3,COIMBATORE,2761,UNITED INSTITUTE OF TECHNOLOGY,,,,,,,
3,COIMBATORE,2357,V.S.B. COLLEGE OF ENGINEERING TECHNICAL CAMPUS,,,,,,,
3,COIMBATORE,2368,VISHNU LAKSHMI COLLEGE OF ENGINEERING AND TECHNOLOGY,,,,,,,
4,CUDDALORE,3425,C.K. COLLEGE OF ENGINEERING AND TECHNOLOGY,,,,,,,
4,CUDDALORE,3822,DR.NAVALAR NEDUNCHEZHIYAN COLLEGE OF ENGINEERING,,,,,,,
4,CUDDALORE,3410,KRISHNASAMY COLLEGE OF ENGINEERING AND TECHNOLOGY,,,,,,,
4,CUDDALORE,3843,M R K INSTITUTE OF TECHNOLOGY,,,,,,,
4,CUDDALORE,3860,St. ANNE'S COLLEGE OF ENGINEERING AND TECHNOLOGY,,,,,,,
4,CUDDALORE,3019,UNIVERSITY COLLEGE OF ENGINEERING  PANRUTI,,,,,,,
5,DHARMAPURI,2369,GOVERNMENT COLLEGE OF ENGINEERING - DHARMAPURI,,,,,,,
5,DHARMAPURI,2640,JAYALAKSHMI INSTITUTE OF TECHNOLOGY,,,,,,,
5,DHARMAPURI,2606,JAYAM COLLEGE OF ENGINEERING AND TECHNOLOGY,,,,,,,
5,DHARMAPURI,2616,SAPTHAGIRI COLLEGE OF ENGINEERING,,,,,,,
5,DHARMAPURI,2683,SHREENIVASA ENGINEERING COLLEGE,,,,,,,
5,DHARMAPURI,2641,VARUVAN VADIVELAN INSTITUTE OF TECHNOLOGY,,,,,,,
6,DINDIGUL,5540,ARINGER ANNA COLLEGE OF ENGINEERING AND TECHNOLOGY,,,,,,,
6,DINDIGUL,5703,CHRISTIAN COLLEGE OF ENGINEERING AND TECHNOLOGY,,,,,,,
6,DINDIGUL,5537,JAINEE COLLEGE OF ENGINEERING AND TECHNOLOGY,,,,,,,
6,DINDIGUL,5832,N P R COLLEGE OF ENGINEERING AND TECHNOLOGY,,,,,,,
6,DINDIGUL,5910,PSNA COLLEGE OF ENGINEERING AND TECHNOLOGY,,,,,,,
6,DINDIGUL,5913,R.V.S. COLLEGE OF ENGINEERING,,,,,,,
6,DINDIGUL,5862,R.V.S. SCHOOL OF ENGINEERING AND TECHNOLOGY,,,,,,,
6,DINDIGUL,5930,SBM COLLEGE OF ENGINEERING AND TECHNOLOGY,,,,,,,
6,DINDIGUL,5720,SRI SUBRAMANYA COLLEGE OF ENGINEERING AND TECHNOLOGY,,,,,,,
6,DINDIGUL,5530,SSM INSTITUTE OF ENGINEERING AND TECHNOLOGY,,,,,,,
6,DINDIGUL,5022,UNIVERSITY COLLEGE OF ENGINEERING  DINDIGUL,,,,,,,
6,DINDIGUL,5851,VEERAMMAL ENGINEERING COLLEGE,,,,,,,
7,ERODE,2332,AISHWARYA COLLEGE OF ENGINEERING AND TECHNOLOGY,,,,,,,
7,ERODE,2652,AL-AMEEN ENGINEERING COLLEGE,,,,,,,
7,ERODE,2702,BANNARI AMMAN INSTITUTE OF TECHNOLOGY (AUTONOMOUS),,,,,,,
7,ERODE,2707,ERODE SENGUNTHAR ENGINEERING COLLEGE,,,,,,,
7,ERODE,2709,INSTITUTE OF ROAD AND TRANSPORT TECHNOLOGY,,,,,,,
7,ERODE,2758,J K K MUNIRAJAH COLLEGE OF TECHNOLOGY,,,,,,,
7,ERODE,2711,KONGU ENGINEERING COLLEGE (AUTONOMOUS),,,,,,,
7,ERODE,2713,M.P. NACHIMUTHU M. JAGANATHAN ENGINEERING COLLEGE,,,,,,,
7,ERODE,2742,MAHARAJA ENGINEERING COLLEGE FOR WOMEN,,,,,,,
7,ERODE,2752,NANDHA COLLEGE OF TECHNOLOGY,,,,,,,
7,ERODE,2715,NANDHA ENGINEERING COLLEGE (AUTONOMOUS),,,,,,,
7,ERODE,2747,SHREE VENKATESHWARA HI-TECH ENGINEERING COLLEGE,,,,,,,
7,ERODE,2748,SURYA ENGINEERING COLLEGE,,,,,,,
7,ERODE,2723,VELALAR COLLEGE OF ENGINEERING AND TECHNOLOGY,,,,,,,
7,ERODE,2337,VIDHYA MANDHIR INSTITUTE OF TECHNOLOGY,,,,,,,
8,KANCHEEPURAM,1323,A.C.T. COLLEGE OF ENGINEERING AND TECHNOLOGY,,,,,,,
8,KANCHEEPURAM,1233,ADHI COLLEGE OF ENGINEERING AND TECHNOLOGY,,,,,,,
8,KANCHEEPURAM,1401,ADHIPARASAKTHI ENGINEERING COLLEGE,,,,,,,
8,KANCHEEPURAM,1316,AGNI COLLEGE OF TECHNOLOGY,,,,,,,
8,KANCHEEPURAM,1331,AKSHEYAA COLLEGE OF ENGINEERING,,,,,,,
8,KANCHEEPURAM,1303,ANAND INSTITUTE OF HIGHER TECHNOLOGY,,,,,,,
8,KANCHEEPURAM,1133,ANNAI VEILANKANNI'S COLLEGE OF ENGINEERING,,,,,,,
8,KANCHEEPURAM,1230,APOLLO ENGINEERING COLLEGE,,,,,,,
8,KANCHEEPURAM,1455,APOLLO PRIYADARSHANAM INSTITUTE OF TECHNOLOGY,,,,,,,
8,KANCHEEPURAM,1201,ARIGNAR ANNA INSTITUTE OF SCIENCE AND TECHNOLOGY,,,,,,,
8,KANCHEEPURAM,1232,ARM COLLEGE OF ENGINEERING AND TECHNOLOGY,,,,,,,
8,KANCHEEPURAM,1334,ARS COLLEGE OF ENGINEERING,,,,,,,
8,KANCHEEPURAM,1423,ASAN MEMORIAL COLLEGE OF ENGINEERING AND TECHNOLOGY,,,,,,,
8,KANCHEEPURAM,1435,BALAJI INSTITUTE OF ENGINEERING AND TECHNOLOGY,,,,,,,
8,KANCHEEPURAM,1444,CHENDU COLLEGE OF ENGINEERING AND TECHNOLOGY,,,,,,,
8,KANCHEEPURAM,1399,CHENNAI INSTITUTE OF TECHNOLOGY,,,,,,,
8,KANCHEEPURAM,1202,D M I COLLEGE OF ENGINEERING,,,,,,,
8,KANCHEEPURAM,1424,DHAANISH AHMED COLLEGE OF ENGINEERING,,,,,,,
8,KANCHEEPURAM,1405,DHANALAKSHMI COLLEGE OF ENGINEERING,,,,,,,
8,KANCHEEPURAM,1322,DHANALAKSHMI SRINIVASAN COLLEGE OF ENGINEERING AND TECHNOLOGY,,,,,,,
8,KANCHEEPURAM,1407,G.K.M. COLLEGE OF ENGINEERING AND TECHNOLOGY,,,,,,,
8,KANCHEEPURAM,1429,GOPAL RAMALINGAM MEMORIAL ENGINEERING COLLEGE,,,,,,,
8,KANCHEEPURAM,1234,INDIRA GANDHI COLLEGE OF ENGINEERING AND TECHNOLOGY FOR WOMEN,,,,,,,
8,KANCHEEPURAM,1235,J E I MATHAAJEE COLLEGE OF ENGINEERING,,,,,,,
8,KANCHEEPURAM,1306,JEPPIAAR ENGINEERING COLLEGE,,,,,,,
8,KANCHEEPURAM,1140,JEPPIAAR INSTITUTE OF TECHNOLOGY,,,,,,,
8,KANCHEEPURAM,1307,JERUSALEM COLLEGE OF ENGINEERING,,,,,,,
8,KANCHEEPURAM,1311,K.C.G. COLLEGE OF TECHNOLOGY,,,,,,,
8,KANCHEEPURAM,1208,KANCHI PALLAVAN ENGINEERING COLLEGE,,,,,,,
8,KANCHEEPURAM,1409,KARPAGA VINAYAGA COLLEGE OF ENGINEERING AND TECHNOLOGY,,,,,,,
8,KANCHEEPURAM,1207,KINGS ENGINEERING COLLEGE,,,,,,,
8,KANCHEEPURAM,1205,LORD VENKATESHWARAA ENGINEERING COLLEGE,,,,,,,
8,KANCHEEPURAM,1225,LOYOLA INSTITUTE OF TECHNOLOGY,,,,,,,
8,KANCHEEPURAM,1206,MAAMALLAN INSTITUTE OF TECHNOLOGY,,,,,,,
8,KANCHEEPURAM,1411,MADHA ENGINEERING COLLEGE,,,,,,,
8,KANCHEEPURAM,1243,MADHA INSTITUTE OF ENGINEERING AND TECHNOLOGY,,,,,,,
8,KANCHEEPURAM,1310,MISRIMAL NAVAJEE MUNOTH JAIN ENGINEERING COLLEGE,,,,,,,
8,KANCHEEPURAM,1301,MOHAMED SATHAK A.J.COLLEGE OF ENGINEERING,,,,,,,
8,KANCHEEPURAM,1431,NEW PRINCE SHRI BHAVANI COLLEGE OF ENGINEERING AND TECHNOLOGY,,,,,,,
8,KANCHEEPURAM,1222,P.B. COLLEGE OF ENGINEERING,,,,,,,
8,KANCHEEPURAM,1226,P.T. LEE CHENGALVARAYA NAICKER COLLEGE OF ENGINEERING AND TECHNOLOGY,,,,,,,
8,KANCHEEPURAM,1104,PALLAVA RAJA COLLEGE OF ENGINEERING,,,,,,,
8,KANCHEEPURAM,1209,PALLAVAN COLLEGE OF ENGINEERING,,,,,,,
8,KANCHEEPURAM,1452,PERI INSTITUTE OF TECHNOLOGY,,,,,,,
8,KANCHEEPURAM,1442,PRINCE Dr.K.VASUDEVAN COLLEGE OF ENGINEERING AND TECHNOLOGY,,,,,,,
8,KANCHEEPURAM,1414,PRINCE SHRI VENKATESHWARA PADMAVATHY ENGINEERING COLLEGE,,,,,,,
8,KANCHEEPURAM,1211,RAJALAKSHMI ENGINEERING COLLEGE,,,,,,,
8,KANCHEEPURAM,1212,RAJIV GANDHI COLLEGE OF ENGINEERING,,,,,,,
8,KANCHEEPURAM,1437,RRASE COLLEGE OF ENGINEERING,,,,,,,
8,KANCHEEPURAM,1320,S.R.R. ENGINEERING COLLEGE,,,,,,,
8,KANCHEEPURAM,1214,SAKTHI MARIAMMAN ENGINEERING COLLEGE,,,,,,,
8,KANCHEEPURAM,1216,SAVEETHA ENGINEERING COLLEGE,,,,,,,
8,KANCHEEPURAM,1313,SHREE MOTILAL KANHAIYALAL FOMRA INSTITUTE OF TECHNOLOGY,,,,,,,
8,KANCHEEPURAM,1417,SHRI ANDAL ALAGAR COLLEGE OF ENGINEERING,,,,,,,
8,KANCHEEPURAM,1427,SRI KRISHNA ENGINEERING COLLEGE,,,,,,,
8,KANCHEEPURAM,1335,SRI KRISHNA INSTITUTE OF TECHNOLOGY,,,,,,,
8,KANCHEEPURAM,1418,SRI LAKSHMI AMMAL ENGINEERING COLLEGE,,,,,,,
8,KANCHEEPURAM,1218,SRI MUTHUKUMARAN INSTITUTE OF TECHNOLOGY,,,,,,,
8,KANCHEEPURAM,1426,SRI RAMANUJAR ENGINEERING COLLEGE,,,,,,,
8,KANCHEEPURAM,1324,SRI SAI RAM INSTITUTE OF TECHNOLOGY,,,,,,,
8,KANCHEEPURAM,1419,SRI SAIRAM ENGINEERING COLLEGE,,,,,,,
8,KANCHEEPURAM,1315,SRI SIVASUBRAMANIYA NADAR COLLEGE OF ENGINEERING,,,,,,,
8,KANCHEEPURAM,1219,SRI VENKATESWARA COLLEGE OF ENGINEERING,,,,,,,
8,KANCHEEPURAM,1413,SRI VENKATESWARAA COLLEGE OF TECHNOLOGY,,,,,,,
8,KANCHEEPURAM,1325,St. JOSEPH COLLEGE OF ENGINEERING,,,,,,,
8,KANCHEEPURAM,1149,St. JOSEPH'S INSTITUTE OF TECHNOLOGY,,,,,,,
8,KANCHEEPURAM,1317,St.JOSEPH'S COLLEGE OF ENGINEERING,,,,,,,
8,KANCHEEPURAM,1318,T.J. INSTITUTE OF TECHNOLOGY,,,,,,,
8,KANCHEEPURAM,1420,TAGORE ENGINEERING COLLEGE,,,,,,,
8,KANCHEEPURAM,1319,THANGAVELU ENGINEERING COLLEGE,,,,,,,
8,KANCHEEPURAM,1517,THIRUMALAI ENGINEERING COLLEGE,,,,,,,
8,KANCHEEPURAM,1026,UNIVERSITY COLLEGE OF ENGINEERING  KANCHIPURAM,,,,,,,
8,KANCHEEPURAM,4,UNIVERSITY DEPARTMENTS OF ANNA UNIVERSITY  CHENNAI - MIT CAMPUS,,,,,,,
8,KANCHEEPURAM,1422,VALLIAMMAI ENGINEERING COLLEGE,,,,,,,
8,KANCHEEPURAM,1333,VI INSTITUTE OF TECHNOLOGY,,,,,,,
9,KANNIYAKUMARI,4999,ANNAI VAILANKANNI COLLEGE OF ENGINEERING,,,,,,,
9,KANNIYAKUMARI,4944,ARUNACHALA COLLEGE OF ENGINEERING FOR WOMEN,,,,,,,
9,KANNIYAKUMARI,4992,BETHLAHEM INSTITUTE OF ENGINEERING,,,,,,,
9,KANNIYAKUMARI,4952,C.S.I. INSTITUTE OF TECHNOLOGY,,,,,,,
9,KANNIYAKUMARI,4946,DMI ENGINEERING COLLEGE,,,,,,,
9,KANNIYAKUMARI,4932,IMMANUEL ARASAR J J COLLEGE OF ENGINEERING,,,,,,,
9,KANNIYAKUMARI,4987,JAMES COLLEGE OF ENGINEERING AND TECHNOLOGY,,,,,,,
9,KANNIYAKUMARI,4956,JAYAMATHA ENGINEERING COLLEGE,,,,,,,
9,KANNIYAKUMARI,4985,K N S K COLLEGE OF ENGINEERING,,,,,,,
9,KANNIYAKUMARI,4983,LORD JEGANNATH COLLEGE OF ENGINEERING AND TECHNOLOGY,,,,,,,
9,KANNIYAKUMARI,4677,LOURDES MOUNT COLLEGE OF ENGINEERING AND TECHNOLOGY,,,,,,,
9,KANNIYAKUMARI,4993,LOYOLA INSTITUTE OF TECHNOLOGY AND SCIENCE,,,,,,,
9,KANNIYAKUMARI,4929,M.E.T ENGINEERING COLLEGE,,,,,,,
9,KANNIYAKUMARI,4928,MAR EPHRAEM COLLEGE OF ENGINEERING AND TECHNOLOGY,,,,,,,
9,KANNIYAKUMARI,4927,MARIA COLLEGE OF ENGINEERING AND TECHNOLOGY,,,,,,,
9,KANNIYAKUMARI,4984,MARTHANDAM COLLEGE OF ENGINEERING AND TECHNOLOGY,,,,,,,
9,KANNIYAKUMARI,4977,NARAYANAGURU COLLEGE OF ENGINEERING,,,,,,,
9,KANNIYAKUMARI,4685,NARAYANAGURU SIDDHARTHA COLLEGE OF ENGINEERING,,,,,,,
9,KANNIYAKUMARI,4981,PONJESLY COLLEGE OF ENGINEERING,,,,,,,
9,KANNIYAKUMARI,4948,RAJAS INTERNATIONAL INSTITUTE OF TECHNOLOGY FOR WOMEN,,,,,,,
9,KANNIYAKUMARI,4670,ROHINI COLLEGE OF ENGINEERING AND TECHNOLOGY,,,,,,,
9,KANNIYAKUMARI,4943,SATYAM COLLEGE OF ENGINEERING AND TECHNOLOGY,,,,,,,
9,KANNIYAKUMARI,4938,SIVAJI COLLEGE OF ENGINEERING AND TECHNOLOGY,,,,,,,
9,KANNIYAKUMARI,4672,STELLA MARY'S COLLEGE OF ENGINEERING,,,,,,,
9,KANNIYAKUMARI,4972,SUN COLLEGE OF ENGINEERING AND TECHNOLOGY,,,,,,,
9,KANNIYAKUMARI,4971,St.XAVIER'S CATHOLIC COLLEGE OF ENGINEERING,,,,,,,
9,KANNIYAKUMARI,4950,TAMIZHAN COLLEGE OF ENGINEERING AND TECHNOLOGY,,,,,,,
9,KANNIYAKUMARI,4978,UDAYA SCHOOL OF ENGINEERING,,,,,,,
9,KANNIYAKUMARI,4023,UNIVERSITY COLLEGE OF ENGINEERING  NAGERCOIL,,,,,,,
9,KANNIYAKUMARI,4982,VINS CHRISTIAN COLLEGE OF ENGINEERING,,,,,,,
9,KANNIYAKUMARI,4945,VINS CHRISTIAN WOMEN'S COLLEGE OF ENGINEERING,,,,,,,
10,KARUR,2356,ARULMURUGAN COLLEGE OF ENGINEERING,,,,,,,
10,KARUR,2355,CHERAN COLLEGE OF ENGINEERING,,,,,,,
10,KARUR,2630,CHETTINAD COLLEGE OF ENGINEERING AND TECHNOLOGY,,,,,,,
10,KARUR,2649,KARUR COLLEGE OF ENGINEERING,,,,,,,
10,KARUR,2608,M.KUMARASAMY COLLEGE OF ENGINEERING (AUTONOMOUS),,,,,,,
10,KARUR,2327,N.S.N. COLLEGE OF ENGINEERING AND TECHNOLOGY,,,,,,,
10,KARUR,2655,V K S COLLEGE OF ENGINEERING AND TECHNOLOGY,,,,,,,
10,KARUR,2622,V.S.B. ENGINEERING COLLEGE,,,,,,,
11,KRISHNAGIRI,2601,ADHIYAMAAN COLLEGE OF ENGINEERING (AUTONOMOUS),,,,,,,
11,KRISHNAGIRI,2621,ER.PERUMAL MANIMEKALAI COLLEGE OF ENGINEERING,,,,,,,
11,KRISHNAGIRI,2603,GOVERNMENT COLLEGE OF ENGINEERING - BARGUR,,,,,,,
11,KRISHNAGIRI,2362,HOSUR INSTITUTE OF TECHNOLOGY AND SCIENCE,,,,,,,
11,KRISHNAGIRI,2642,P.S.V.COLLEGE OF ENGINEERING AND TECHNOLOGY,,,,,,,
11,KRISHNAGIRI,2340,SRI VENKATESHWARA INSTITUTE OF ENGINEERING,,,,,,,
12,MADURAI,5531,C.R. ENGINEERING COLLEGE,,,,,,,
12,MADURAI,5935,FATIMA MICHAEL COLLEGE OF ENGINEERING AND TECHNOLOGY,,,,,,,
12,MADURAI,5990,LATHA MATHAVAN ENGINEERING COLLEGE,,,,,,,
12,MADURAI,5536,MANGAYARKARASI COLLEGE OF ENGINEERING,,,,,,,
12,MADURAI,5911,P.T.R.COLLEGE OF ENGINEERING AND TECHNOLOGY,,,,,,,
12,MADURAI,5914,RAJA COLLEGE OF ENGINEERING AND TECHNOLOGY,,,,,,,
12,MADURAI,5915,SACS M.A.V.M.M ENGINEERING COLLEGE,,,,,,,
12,MADURAI,5008,THIAGARAJAR COLLEGE OF ENGINEERING (AUTONOMOUS),,,,,,,
12,MADURAI,5942,ULTRA COLLEGE OF ENGINEERING AND TECHNOLOGY FOR WOMEN,,,,,,,
12,MADURAI,5532,VAIGAI COLLEGE OF ENGINEERING,,,,,,,
12,MADURAI,5986,VELAMMAL COLLEGE OF ENGINEERING AND TECHNOLOGY,,,,,,,
12,MADURAI,5922,VICKRAM COLLEGE OF ENGINEERING,,,,,,,
13,NAGAPATTINAM,3801,A.V.C COLLEGE OF ENGINEERING,,,,,,,
13,NAGAPATTINAM,3806,E.G.S.PILLAY ENGINEERING COLLEGE,,,,,,,
13,NAGAPATTINAM,3461,HAJI SHEIK ISMAIL ENGINEERING COLLEGE,,,,,,,
13,NAGAPATTINAM,3859,SEMBODAI RUKMANI VARATHARAJAN ENGINEERING COLLEGE,,,,,,,
13,NAGAPATTINAM,3760,SIR ISSAC NEWTON COLLEGE OF ENGINEERING AND TECHNOLOGY,,,,,,,
13,NAGAPATTINAM,3018,UNIVERSITY COLLEGE OF ENGINEERING  THIRUKKUVALAI,,,,,,,
14,NAMAKKAL,2602,ANNAI MATHAMMAL SHEELA ENGINEERING COLLEGE,,,,,,,
14,NAMAKKAL,2635,CMS COLLEGE OF ENGINEERING,,,,,,,
14,NAMAKKAL,2662,DR.NAGARATHINAM'S COLLEGE OF ENGINEERING,,,,,,,
14,NAMAKKAL,2664,EXCEL COLLEGE OF ENGINEERING AND TECHNOLOGY,,,,,,,
14,NAMAKKAL,2634,EXCEL ENGINEERING COLLEGE,,,,,,,
14,NAMAKKAL,2660,GNANAMANI COLLEGE OF ENGINEERING,,,,,,,
14,NAMAKKAL,2624,GNANAMANI COLLEGE OF TECHNOLOGY,,,,,,,
14,NAMAKKAL,2647,J.K.K. NATTRAJA COLLEGE OF ENGINEERING AND TECHNOLOGY,,,,,,,
14,NAMAKKAL,2328,K S R INSTITUTE FOR ENGINEERING AND TECHNOLOGY,,,,,,,
14,NAMAKKAL,2613,K.S.R. COLLEGE OF ENGINEERING (AUTONOMOUS),,,,,,,
14,NAMAKKAL,2607,K.S.RANGASAMY COLLEGE OF TECHNOLOGY (AUTONOMOUS),,,,,,,
14,NAMAKKAL,2631,KING COLLEGE OF TECHNOLOGY,,,,,,,
14,NAMAKKAL,2609,MAHENDRA ENGINEERING COLLEGE (AUTONOMOUS),,,,,,,
14,NAMAKKAL,2638,MAHENDRA ENGINEERING COLLEGE FOR WOMEN,,,,,,,
14,NAMAKKAL,2665,MAHENDRA INSTITUTE OF ENGINEERING AND TECHNOLOGY,,,,,,,
14,NAMAKKAL,2632,MAHENDRA INSTITUTE OF TECHNOLOGY,,,,,,,
14,NAMAKKAL,2314,MUTHAYAMMAL COLLEGE OF ENGINEERING,,,,,,,
14,NAMAKKAL,2610,MUTHAYAMMAL ENGINEERING COLLEGE,,,,,,,
14,NAMAKKAL,2612,P G P COLLEGE OF ENGINEERING AND TECHNOLOGY,,,,,,,
14,NAMAKKAL,2628,PAAVAI COLLEGE OF ENGINEERING,,,,,,,
14,NAMAKKAL,2611,PAAVAI ENGINEERING COLLEGE (AUTONOMOUS),,,,,,,
14,NAMAKKAL,2657,PAVAI COLLEGE OF TECHNOLOGY,,,,,,,
14,NAMAKKAL,2614,S.S.M. COLLEGE OF ENGINEERING,,,,,,,
14,NAMAKKAL,2627,SELVAM COLLEGE OF TECHNOLOGY,,,,,,,
14,NAMAKKAL,2629,SENGUNTHAR COLLEGE OF ENGINEERING,,,,,,,
14,NAMAKKAL,2617,SENGUNTHAR ENGINEERING COLLEGE,,,,,,,
14,NAMAKKAL,2767,SRG ENGINEERING COLLEGE,,,,,,,
14,NAMAKKAL,2633,VIDYAA VIKAS COLLEGE OF ENGINEERING AND TECHNOLOGY,,,,,,,
14,NAMAKKAL,2620,VIVEKANANDHA COLLEGE OF ENGINEERING FOR WOMEN (AUTONOMOUS),,,,,,,
14,NAMAKKAL,2661,VIVEKANANDHA COLLEGE OF TECHNOLOGY FOR WOMEN,,,,,,,
14,NAMAKKAL,2626,VIVEKANANDHA INSTITUTE OF ENGINEERING & TECHNOLOGY FOR WOMEN,,,,,,,
15,PERAMBALUR,3457,DHANALAKSHMI SRINIVASAN COLLEGE OF ENGINEERING,,,,,,,
15,PERAMBALUR,3805,DHANALAKSHMI SRINIVASAN ENGINEERING COLLEGE,,,,,,,
15,PERAMBALUR,3458,DHANALAKSHMI SRINIVASAN INSTITUTE OF RESEARCH AND TECHNOLOGY,,,,,,,
15,PERAMBALUR,3463,ELIZABETH COLLEGE OF ENGINEERING AND TECHNOLOGY,,,,,,,
15,PERAMBALUR,3847,ROEVER COLLEGE OF ENGINEERING AND TECHNOLOGY,,,,,,,
15,PERAMBALUR,3817,ROEVER ENGINEERING COLLEGE,,,,,,,
15,PERAMBALUR,3454,SRI RAMAKRISHNA COLLEGE OF ENGINEERING,,,,,,,
15,PERAMBALUR,3823,SRINIVASAN ENGINEERING COLLEGE,,,,,,,
16,PUDUKKOTTAI,3926,CHENDHURAN COLLEGE OF ENGINEERING AND TECHNOLOGY,,,,,,,
16,PUDUKKOTTAI,3905,KINGS COLLEGE OF ENGINEERING,,,,,,,
16,PUDUKKOTTAI,3925,M.A.R. COLLEGE OF ENGINEERING AND TECHNOLOGY,,,,,,,
16,PUDUKKOTTAI,3854,MAHATH AMMA INSTITUTE OF ENGINEERING AND TECHNOLOGY,,,,,,,
16,PUDUKKOTTAI,3923,MNSK COLLEGE OF ENGINEERING,,,,,,,
16,PUDUKKOTTAI,3812,MOOKAMBIGAI COLLEGE OF ENGINEERING,,,,,,,
16,PUDUKKOTTAI,3846,MOTHER TERASA COLLEGE OF ENGINEERING AND TECHNOLOGY,,,,,,,
16,PUDUKKOTTAI,3908,MOUNT ZION COLLEGE OF ENGINEERING AND TECHNOLOGY,,,,,,,
16,PUDUKKOTTAI,3918,SHANMUGANATHAN ENGINEERING COLLEGE,,,,,,,
16,PUDUKKOTTAI,3852,SRI BHARATHI ENGINEERING COLLEGE FOR WOMEN,,,,,,,
16,PUDUKKOTTAI,3920,SUDHARSAN ENGINEERING COLLEGE,,,,,,,
17,RAMANATHAPURAM,5924,GANAPATHY CHETTIAR COLLEGE OF ENGINEERING AND TECHNOLOGY,,,,,,,
17,RAMANATHAPURAM,5907,MOHAMED SATHAK ENGINEERING COLLEGE,,,,,,,
17,RAMANATHAPURAM,5921,SYED AMMAL ENGINEERING COLLEGE,,,,,,,
17,RAMANATHAPURAM,5017,UNIVERSITY COLLEGE OF ENGINEERING  RAMANATHAPURAM,,,,,,,
18,SALEM,2636,A V S ENGINEERING COLLEGE,,,,,,,
18,SALEM,2648,ANNAPOORANA ENGINEERING COLLEGE,,,,,,,
18,SALEM,2347,AVS COLLEGE OF TECHNOLOGY,,,,,,,
18,SALEM,2643,BHARATHIYAR INSTITUTE OF ENGINEERING FOR WOMEN,,,,,,,
18,SALEM,2345,DHIRAJLAL GANDHI COLLEGE OF TECHNOLOGY,,,,,,,
18,SALEM,2341,GANESH COLLEGE OF ENGINEERING,,,,,,,
18,SALEM,2615,GOVERNMENT COLLEGE OF ENGINEERING - SALEM (AUTONOMOUS),,,,,,,
18,SALEM,2343,INDIAN INSTITUTE OF HANDLOOM TECHNOLOGY,,,,,,,
18,SALEM,2653,KNOWLEDGE INSTITUTE OF TECHNOLOGY,,,,,,,
18,SALEM,2623,MAHENDRA COLLEGE OF ENGINEERING,,,,,,,
18,SALEM,2639,NARASU'S SARATHY INSTITUTE OF TECHNOLOGY,,,,,,,
18,SALEM,2663,S R S COLLEGE OF ENGINEERING AND TECHNOLOGY,,,,,,,
18,SALEM,2659,SALEM COLLEGE OF ENGINEERING AND TECHNOLOGY,,,,,,,
18,SALEM,2346,SHREE SATHYAM COLLEGE OF ENGINEERING AND TECHNOLOGY,,,,,,,
18,SALEM,2618,SONA COLLEGE OF TECHNOLOGY (AUTONOMOUS),,,,,,,
18,SALEM,2302,SRI SHANMUGHA COLLEGE OF ENGINEERING AND TECHNOLOGY,,,,,,,
18,SALEM,2646,TAGORE INSTITUTE OF ENGINEERING AND TECHNOLOGY,,,,,,,
18,SALEM,2666,THE KAVERY COLLEGE OF ENGINEERING,,,,,,,
18,SALEM,2625,THE KAVERY ENGINEERING COLLEGE,,,,,,,
18,SALEM,2658,V S A EDUCATIONAL AND CHARITABLE TRUST'S GROUP OF INSTITUTIONS,,,,,,,
19,SIVAGANGA,5901,A.C.COLLEGE OF ENGINEERING AND TECHNOLOGY (AUTONOMOUS),,,,,,,
19,SIVAGANGA,5012,CENTRAL ELECTROCHEMICAL RESEARCH INSTITUTE (CSIR) KARAIKUDI,,,,,,,
19,SIVAGANGA,5904,K.L.N.COLLEGE OF ENGINEERING,,,,,,,
19,SIVAGANGA,5903,K.L.N.COLLEGE OF INFORMATION TECHNOLOGY,,,,,,,
19,SIVAGANGA,5533,KIT & KIM TECHNICAL CAMPUS,,,,,,,
19,SIVAGANGA,5842,MADURAI INSTITUTE OF ENGINEERING AND TECHNOLOGY,,,,,,,
19,SIVAGANGA,5912,PANDIAN SARASWATHI YADAV ENGINEERING COLLEGE,,,,,,,
19,SIVAGANGA,5916,PANNAI COLLEGE OF ENGINEERING AND TECHNOLOGY,,,,,,,
19,SIVAGANGA,5502,SRI RAAJA RAAJAN COLLEGE OF ENGINEERING AND TECHNOLOGY,,,,,,,
19,SIVAGANGA,5919,St.MICHAEL COLLEGE OF ENGINEERING & TECHNOLOGY,,,,,,,
20,THANJAVUR,3849,ANNAI COLLEGE OF ENGINEERING AND TECHNOLOGY,,,,,,,
20,THANJAVUR,3804,ARASU ENGINEERING COLLEGE,,,,,,,
20,THANJAVUR,3855,AS-SALAM COLLEGE OF ENGINEERING AND TECHNOLOGY,,,,,,,
20,THANJAVUR,3464,GOVERNMENT COLLEGE OF ENGINEERING - THANJAVUR,,,,,,,
20,THANJAVUR,3456,K.S.K COLLEGE OF ENGINEERING AND TECHNOLOGY,,,,,,,
20,THANJAVUR,3814,P.R.ENGINEERING COLLEGE,,,,,,,
20,THANJAVUR,3833,PARISUTHAM INSTITUTE OF TECHNOLOGY AND SCIENCE,,,,,,,
20,THANJAVUR,3451,SMR EAST COAST COLLEGE OF ENGINEERING AND TECHNOLOGY,,,,,,,
20,THANJAVUR,3766,STAR LION COLLEGE OF ENGINEERING AND TECHNOLOGY,,,,,,,
20,THANJAVUR,3825,St. JOSEPH'S COLLEGE OF ENGINEERING AND TECHNOLOGY,,,,,,,
20,THANJAVUR,3021,UNIVERSITY COLLEGE OF ENGINEERING  PATTUKKOTTAI,,,,,,,
20,THANJAVUR,3848,VANDAYAR ENGINEERING COLLEGE,,,,,,,
21,THE_NILGIRIS,2705,CSI COLLEGE OF ENGINEERING,,,,,,,
22,THENI,5902,BHARATH NIKETAN ENGINEERING COLLEGE,,,,,,,
22,THENI,5009,GOVERNMENT COLLEGE OF ENGINEERING  BODIYANAYAKKANUR,,,,,,,
22,THENI,5865,NADAR SARASWATHI COLLEGE OF ENGINEERING & TECHNOLOGY,,,,,,,
22,THENI,5909,ODAIYAPPA COLLEGE OF ENGINEERING AND TECHNOLOGY,,,,,,,
22,THENI,5988,THENI KAMMAVAR SANGAM COLLEGE OF TECHNOLOGY,,,,,,,
22,THENI,5535,VPV COLLEGE OF ENGINEERING,,,,,,,
23,THIRUVALLUR,1101,AALIM MUHAMMED SALEGH COLLEGE OF ENGINEERING,,,,,,,
23,THIRUVALLUR,1228,ALPHA COLLEGE OF ENGINEERING,,,,,,,
23,THIRUVALLUR,1102,BHAJARANG ENGINEERING COLLEGE,,,,,,,
23,THIRUVALLUR,1304,EASWARI ENGINEERING COLLEGE,,,,,,,
23,THIRUVALLUR,1123,GOJAN SCHOOL OF BUSINESS AND TECHNOLOGY,,,,,,,
23,THIRUVALLUR,1238,GRT INSTITUTE OF ENGINEERING AND TECHNOLOGY,,,,,,,
23,THIRUVALLUR,1229,INDIRA INSTITUTE OF ENGINEERING AND TECHNOLOGY,,,,,,,
23,THIRUVALLUR,1221,JAYA COLLEGE OF ENGINEERING AND TECHNOLOGY,,,,,,,
23,THIRUVALLUR,1106,JAYA ENGINEERING COLLEGE,,,,,,,
23,THIRUVALLUR,1107,JAYA INSTITUTE OF TECHNOLOGY,,,,,,,
23,THIRUVALLUR,1416,JAYA SAKTHI ENGINEERING COLLEGE,,,,,,,
23,THIRUVALLUR,1440,JAYA SURIYA ENGINEERING COLLEGE,,,,,,,
23,THIRUVALLUR,1126,JNN INSTITUTE OF ENGINEERING,,,,,,,
23,THIRUVALLUR,1245,JOHN BOSCO ENGINEERING COLLEGE,,,,,,,
23,THIRUVALLUR,1108,MAGNA COLLEGE OF ENGINEERING,,,,,,,
23,THIRUVALLUR,1210,PANIMALAR ENGINEERING COLLEGE,,,,,,,
23,THIRUVALLUR,1231,PANIMALAR INSTITUTE OF TECHNOLOGY,,,,,,,
23,THIRUVALLUR,1125,PMR ENGINEERING COLLEGE,,,,,,,
23,THIRUVALLUR,1110,PRATHYUSHA INSTITUTE OF TECHNOLOGY AND MANAGEMENT,,,,,,,
23,THIRUVALLUR,1112,R.M.D. ENGINEERING COLLEGE,,,,,,,
23,THIRUVALLUR,1128,R.M.K. COLLEGE OF ENGINEERING AND TECHNOLOGY,,,,,,,
23,THIRUVALLUR,1113,R.M.K. ENGINEERING COLLEGE,,,,,,,
23,THIRUVALLUR,1141,R.V.S. PADHMAVATHY COLLEGE OF ENGINEERING & TECHNOLOGY,,,,,,,
23,THIRUVALLUR,1432,RAJALAKSHMI INSTITUTE OF TECHNOLOGY,,,,,,,
23,THIRUVALLUR,1114,S.A. ENGINEERING COLLEGE,,,,,,,
23,THIRUVALLUR,1213,S.K.R. ENGINEERING COLLEGE,,,,,,,
23,THIRUVALLUR,1124,SAMS COLLEGE OF ENGINEERING AND TECHNOLOGY,,,,,,,
23,THIRUVALLUR,1242,SREE SASTHA COLLEGE OF ENGINEERING,,,,,,,
23,THIRUVALLUR,1217,SREE SASTHA INSTITUTE OF ENGINEERING AND TECHNOLOGY,,,,,,,
23,THIRUVALLUR,1150,SRI JAYARAM INSTITUTE OF ENGINEERING AND TECHNOLOGY,,,,,,,
23,THIRUVALLUR,1116,SRI VENKATESWARA COLLEGE OF ENGINEERING AND TECHNOLOGY,,,,,,,
23,THIRUVALLUR,1121,SRI VENKATESWARA INSTITUTE OF SCIENCE AND TECHNOLOGY,,,,,,,
23,THIRUVALLUR,1115,SRIRAM ENGINEERING COLLEGE,,,,,,,
23,THIRUVALLUR,1127,St. PETER'S COLLEGE OF ENGINEERING AND TECHNOLOGY,,,,,,,
23,THIRUVALLUR,1241,T.J.S. ENGINEERING COLLEGE,,,,,,,
23,THIRUVALLUR,1131,VEL TECH,,,,,,,
23,THIRUVALLUR,1122,VEL TECH HIGH TECH DR.RANGARAJAN DR.SAKUNTHALA ENGINEERING COLLEGE,,,,,,,
23,THIRUVALLUR,1118,VEL TECH MULTI TECH DR.RANGARAJAN DR.SAKUNTHALA ENGINEERING COLLEGE,,,,,,,
23,THIRUVALLUR,1120,VELAMMAL ENGINEERING COLLEGE,,,,,,,
23,THIRUVALLUR,1237,VELAMMAL INSTITUTE OF TECHNOLOGY,,,,,,,
